{
  "starbook": 1,
  "id": "starbook.first-stories",
  "revision": 2,
  "title": "First stories",
  "author": "Starbook",
  "license": "CC0-1.0",
  "stories": [
    {
      "id": "i-see",
      "title": "I see",
      "level": 1,
      "cover": "cat",
      "pages": [
        {
          "text": "I see a cat.",
          "picture": "cat"
        },
        {
          "text": "I see a hen.",
          "picture": "hen"
        },
        {
          "text": "I see a pig.",
          "picture": "pig"
        },
        {
          "text": "I see a dog.",
          "picture": "dog"
        },
        {
          "text": "I see a bug.",
          "picture": "bug"
        },
        {
          "text": "I see a bed.",
          "picture": "bed"
        },
        {
          "text": "I see a cup.",
          "picture": "cup"
        },
        {
          "text": "I see a hat.",
          "picture": "hat"
        },
        {
          "text": "I see my mum.",
          "picture": "mother"
        },
        {
          "text": "I like my mum!",
          "picture": "heart"
        }
      ]
    },
    {
      "id": "the-red-hen",
      "title": "The red hen",
      "level": 1,
      "cover": "hen",
      "pages": [
        {
          "text": "The hen is red.",
          "picture": "hen"
        },
        {
          "text": "The hen is in a pen.",
          "picture": "hen"
        },
        {
          "text": "The hen can run.",
          "picture": "hen"
        },
        {
          "text": "The hen can dig.",
          "picture": "hen"
        },
        {
          "text": "The hen has a bug.",
          "picture": "bug"
        },
        {
          "text": "The dog is on a mat.",
          "picture": "dog"
        },
        {
          "text": "The dog can see the hen.",
          "picture": "dog"
        },
        {
          "text": "The hen and the dog sit.",
          "picture": "dog"
        },
        {
          "text": "I like the hen!",
          "picture": "hen"
        }
      ]
    },
    {
      "id": "i-can",
      "title": "I can",
      "level": 1,
      "cover": "kid",
      "pages": [
        {
          "text": "I can run.",
          "picture": "kid"
        },
        {
          "text": "I can hop.",
          "picture": "girl"
        },
        {
          "text": "I can sit.",
          "picture": "chair"
        },
        {
          "text": "I can tap.",
          "picture": "drum"
        },
        {
          "text": "I can dig.",
          "picture": "bucket"
        },
        {
          "text": "I can hug my dad.",
          "picture": "father"
        },
        {
          "text": "I can nap.",
          "picture": "sleep"
        },
        {
          "text": "I can go up.",
          "picture": "swing"
        },
        {
          "text": "I can go up and up!",
          "picture": "swing"
        },
        {
          "text": "I am a big kid!",
          "picture": "kid"
        }
      ]
    },
    {
      "id": "the-mango-tree",
      "title": "The mango tree",
      "level": 2,
      "cover": "mango-tree",
      "pages": [
        {
          "text": "Aaji has a big mango tree.",
          "picture": "mango-tree"
        },
        {
          "text": "Dad and I go to the tree.",
          "picture": "father"
        },
        {
          "text": "The sun is hot.",
          "picture": "sun"
        },
        {
          "text": "A bug is on the tree.",
          "picture": "bug"
        },
        {
          "text": "I see a red mango.",
          "picture": "mango"
        },
        {
          "text": "Dad can get it.",
          "picture": "father"
        },
        {
          "text": "I sit and eat the mango.",
          "picture": "mango"
        },
        {
          "text": "Yum, yum!",
          "picture": "smile"
        },
        {
          "text": "Aaji has a bit.",
          "picture": "grandmother"
        },
        {
          "text": "I like the mango tree!",
          "picture": "mango-tree"
        }
      ],
      "say": {
        "Aaji": "aa-jee"
      }
    },
    {
      "id": "auto-ride",
      "title": "Auto ride",
      "level": 2,
      "cover": "auto-rickshaw",
      "pages": [
        {
          "text": "Dad and I go in an auto.",
          "picture": "auto-rickshaw"
        },
        {
          "text": "The auto is not big.",
          "picture": "auto-rickshaw"
        },
        {
          "text": "The auto can zip.",
          "picture": "auto-rickshaw"
        },
        {
          "text": "Zip, zip, zip!",
          "picture": "auto-rickshaw"
        },
        {
          "text": "Rain!",
          "picture": "cloud"
        },
        {
          "text": "The rain is wet.",
          "picture": "rain"
        },
        {
          "text": "The auto has a top.",
          "picture": "umbrella"
        },
        {
          "text": "We sit and sit.",
          "picture": "auto-rickshaw"
        },
        {
          "text": "The rain is on the top.",
          "picture": "rain"
        },
        {
          "text": "I like the rain!",
          "picture": "smile"
        }
      ]
    },
    {
      "id": "my-birthday",
      "title": "My birthday",
      "level": 2,
      "cover": "birthday-cake",
      "pages": [
        {
          "text": "It is my birthday!",
          "picture": "balloon"
        },
        {
          "text": "Mum and Dad hug me.",
          "picture": "mother"
        },
        {
          "text": "Aaji has a hat for me.",
          "picture": "grandmother"
        },
        {
          "text": "It is a red hat.",
          "picture": "party-hat"
        },
        {
          "text": "I put on the hat.",
          "picture": "party-hat"
        },
        {
          "text": "I see a big cake.",
          "picture": "birthday-cake"
        },
        {
          "text": "Dad can cut the cake.",
          "picture": "father"
        },
        {
          "text": "I get a big bit.",
          "picture": "cake-slice"
        },
        {
          "text": "Yum, yum, yum!",
          "picture": "smile"
        },
        {
          "text": "I like my birthday!",
          "picture": "party-popper"
        }
      ],
      "say": {
        "Aaji": "aa-jee"
      }
    },
    {
      "id": "one-two-three",
      "title": "One, two, three",
      "level": 1,
      "cover": "books",
      "pages": [
        {
          "text": "I see one sun.",
          "picture": "sun"
        },
        {
          "text": "I see one moon.",
          "picture": "moon"
        },
        {
          "text": "I see two eyes.",
          "picture": "eyes"
        },
        {
          "text": "I see two socks.",
          "picture": "sock"
        },
        {
          "text": "I see three books.",
          "picture": "books"
        },
        {
          "text": "I see three candles.",
          "picture": "birthday-cake"
        },
        {
          "text": "One, two, three candles. Blow!",
          "picture": "birthday-cake"
        }
      ]
    },
    {
      "id": "snack-time",
      "title": "Snack time",
      "level": 1,
      "cover": "mango",
      "pages": [
        {
          "text": "One mango for me.",
          "picture": "mango"
        },
        {
          "text": "One banana for Dad.",
          "picture": "banana"
        },
        {
          "text": "Two peas for the baby.",
          "picture": "peas"
        },
        {
          "text": "Two lychees for Mum.",
          "picture": "lychee"
        },
        {
          "text": "Three imli for Aaji.",
          "picture": "tamarind"
        },
        {
          "text": "One, two, three imli. Yum!",
          "picture": "tamarind"
        }
      ],
      "say": {
        "Aaji": "aa-jee"
      }
    },
    {
      "id": "four-five-six",
      "title": "Four, five, six",
      "level": 2,
      "cover": "butterfly",
      "pages": [
        {
          "text": "A chair has four legs.",
          "picture": "chair"
        },
        {
          "text": "A square has four sides.",
          "picture": "square"
        },
        {
          "text": "A butterfly has four wings.",
          "picture": "butterfly"
        },
        {
          "text": "My hand has five fingers.",
          "picture": "hands"
        },
        {
          "text": "A star has five points.",
          "picture": "star-shape"
        },
        {
          "text": "This flower has five petals.",
          "picture": "flower"
        },
        {
          "text": "This shape has six sides.",
          "picture": "hexagon"
        },
        {
          "text": "One, two, three, four, five, six sides!",
          "picture": "hexagon"
        }
      ]
    }
  ]
}
